<?xml version="1.0"?><!DOCTYPE board SYSTEM "kb_in.dtd"><board><context>Thisisatextdescribingthecontext</context><goals><goal>Thisisatextdescribingagoal</goal><goal>Thisisatextdescribinganothergoal</goal></goals><content>Thisisatextdescribingsomecontent</content><columns><column id="1"><csw-technique><call-for-suggestion /></csw-technique><aba-css-task><call-for-suggestion /></aba-css-task><aba-css-team/><aba-css-tec1/><aba-css-tec2/><abb-css-task/><abb-css-team/><abb-css-tec1/><abb-css-tec2/></column><column id="2"><csw-technique><technique-name/><technique-phase/></csw-technique><aba-css-task/><aba-css-team/><aba-css-tec1/><aba-css-tec2/><abb-css-task/><abb-css-team/><abb-css-tec1/><abb-css-tec2/></column><column id="3"><csw-technique><technique-name/><technique-phase/></csw-technique><aba-css-task/><aba-css-team/><aba-css-tec1/><aba-css-tec2/><abb-css-task/><abb-css-team/><abb-css-tec1/><abb-css-tec2/></column><column id="4"><csw-technique><technique-name/><technique-phase/></csw-technique><aba-css-task/><aba-css-team/><aba-css-tec1/><aba-css-tec2/><abb-css-task/><abb-css-team/><abb-css-tec1/><abb-css-tec2/></column></columns></board>
