<?xml version="1.0"?><!DOCTYPE board SYSTEM "kb_in.dtd"><board><context>This is a text describing the context</context><goals><goal>This is a text describing a goal</goal><goal>This is a text describing another goal</goal></goals><content>This is a text describing some content</content><columns><column id="1"><csw-technique><technique-name>DISCUSSION _ PHASE I _ALL CASES_</technique-name><technique-phase>1</technique-phase></csw-technique><aba-css-task>FINDING MATERIALS</aba-css-task><aba-css-team>INDIVIDUAL LEARNERS</aba-css-team><aba-css-tec1>SOURCE OF MATERIALS FOR LEARNING</aba-css-tec1><aba-css-tec2/><abb-css-task/><abb-css-team/><abb-css-tec1/><abb-css-tec2/></column><column id="2"><csw-technique><technique-name/><technique-phase/></csw-technique><aba-css-task>DEBATING</aba-css-task><aba-css-team/><aba-css-tec1>NO TECHNOLOGY</aba-css-tec1><aba-css-tec2/><abb-css-task/><abb-css-team/><abb-css-tec1/><abb-css-tec2/></column><column id="3"><csw-technique><technique-name/><technique-phase/></csw-technique><aba-css-task/><aba-css-team/><aba-css-tec1/><aba-css-tec2/><abb-css-task/><abb-css-team/><abb-css-tec1/><abb-css-tec2/></column><column id="4"><csw-technique><technique-name>DISCUSSION _TOWARDS ARTEFACT_ _ PHASE II</technique-name><technique-phase>2</technique-phase></csw-technique><aba-css-task>PRODUCING AN ARTEFACT </aba-css-task><aba-css-team>SMALL GROUPS</aba-css-team><aba-css-tec1>MATERIALS AND TOOLS FOR PRACTICE</aba-css-tec1><aba-css-tec2>NO TECHNOLOGY</aba-css-tec2><abb-css-task/><abb-css-team/><abb-css-tec1/><abb-css-tec2/></column></columns></board>