<?xml version="1.0"?><!DOCTYPE board SYSTEM "kb_in.dtd"><board><context>This is a text describing the context</context><goals><goal>This is a text describing a goal</goal><goal>This is a text describing another goal</goal></goals><content>This is a text describing some content</content><columns><column id="1"><csw-technique><technique-name>PYRAMID _FOR LIST PREPARATION_ _ PHASE I</technique-name><technique-phase>1</technique-phase></csw-technique><aba-css-task>STUDYING</aba-css-task><aba-css-team>INDIVIDUAL LEARNERS</aba-css-team><aba-css-tec1>SELECTED STUDY MATERIALS</aba-css-tec1><aba-css-tec2/><abb-css-task/><abb-css-team/><abb-css-tec1/><abb-css-tec2/></column><column id="2"><csw-technique><technique-name/><technique-phase/></csw-technique><aba-css-task>PREPARING A LIST OF QUESTIONS</aba-css-task><aba-css-team>INDIVIDUAL LEARNERS</aba-css-team><aba-css-tec1>TEXT EDITOR</aba-css-tec1><aba-css-tec2/><abb-css-task/><abb-css-team/><abb-css-tec1/><abb-css-tec2/></column><column id="3"><csw-technique><technique-name>PYRAMID _FOR LIST PREPARATION_ _ PHASE II</technique-name><technique-phase>2</technique-phase></csw-technique><aba-css-task>PREPARING A LIST OF QUESTIONS</aba-css-task><aba-css-team>SMALL GROUPS</aba-css-team><aba-css-tec1>TEXT EDITOR</aba-css-tec1><aba-css-tec2/><abb-css-task/><abb-css-team/><abb-css-tec1/><abb-css-tec2/></column><column id="4"><csw-technique><technique-name>PYRAMID _FOR LIST PREPARATION_ _ PHASE III</technique-name><technique-phase>3</technique-phase></csw-technique><aba-css-task>PREPARING A LIST OF QUESTIONS</aba-css-task><aba-css-team>PLENARY</aba-css-team><aba-css-tec1>TEXT EDITOR</aba-css-tec1><aba-css-tec2/><abb-css-task/><abb-css-team/><abb-css-tec1/><abb-css-tec2/></column></columns></board>